{"version":"0.8.0","subject":"english","school_stage":"upper_secondary","curriculum_profile":"it-upper-english-professionale-b1plus-v0.8","effective_from_school_year":"2026/27","effective_to_school_year":null,"sequencing_note":"Overlay professionale B1/B1+ funzionale, con B2 come estensione non obbligatoria nel profilo TutorLab.","layer":{"kind":"family_core","family":"professionale","profile_ids":[]},"nodes":[{"id":"eng.us.prof.vocabulary-work-b1","title":"Lessico professionale essenziale B1","strand":"professional_language","stage_year":3,"priority":"gateway","prerequisites":["eng.us.vocabulary.education-work-b1plus"],"objectives":["Usare lessico ad alta frequenza del lavoro e del servizio","Comprendere istruzioni e richieste del proprio ambito"],"mastery_evidence":["Usa termini essenziali in collocazioni plausibili","Parafrasa quando manca un termine"],"difficulty_levers":["language_demand","professional_domain"],"cefr_anchor":"B1","progression_stage":"B1_core"},{"id":"eng.us.prof.reading-work-b1","title":"Reading B1 professionale","strand":"reading","stage_year":3,"priority":"core","prerequisites":["eng.us.reading.b1-argument-sequence","eng.us.prof.vocabulary-work-b1"],"objectives":["Comprendere istruzioni, messaggi e documenti professionali lineari","Trovare dati, sequenze e avvertenze"],"mastery_evidence":["Identifica azioni richieste e vincoli","Distingue istruzione da informazione di sfondo"],"difficulty_levers":["information_load","professional_domain"],"cefr_anchor":"B1","progression_stage":"B1_core"},{"id":"eng.us.prof.listening-work-b1","title":"Listening B1 professionale","strand":"listening","stage_year":3,"priority":"core","prerequisites":["eng.us.listening.b1-extended","eng.us.prof.vocabulary-work-b1"],"objectives":["Comprendere consegne, richieste e spiegazioni chiare sul lavoro","Confermare dettagli operativi"],"mastery_evidence":["Coglie compito, tempi e condizioni","Chiede chiarimenti quando necessario"],"difficulty_levers":["language_demand","professional_domain"],"cefr_anchor":"B1","progression_stage":"B1_core"},{"id":"eng.us.prof.interaction-service-b1","title":"Interazione B1 con colleghi e utenti","strand":"spoken_interaction","stage_year":4,"priority":"gateway","prerequisites":["eng.us.prof.listening-work-b1","eng.us.interaction.b1-opinions"],"objectives":["Gestire richieste, problemi e semplici negoziazioni","Usare formule appropriate al ruolo e al destinatario"],"mastery_evidence":["Mantiene lo scambio fino alla soluzione","Controlla la comprensione reciproca"],"difficulty_levers":["productive_freedom","sociolinguistic_demand"],"cefr_anchor":"B1","progression_stage":"B1_plus"},{"id":"eng.us.prof.writing-work-b1","title":"Writing B1 professionale","strand":"writing","stage_year":4,"priority":"core","prerequisites":["eng.us.writing.b1-functional-texts","eng.us.prof.vocabulary-work-b1"],"objectives":["Scrivere email, note e brevi report funzionali","Organizzare informazioni operative in modo chiaro"],"mastery_evidence":["Messaggio, azione richiesta e dettagli sono riconoscibili","Registro sufficientemente appropriato"],"difficulty_levers":["discourse_span","professional_domain"],"cefr_anchor":"B1","progression_stage":"B1_plus"},{"id":"eng.us.prof.mediation-work-b1","title":"Mediazione B1 di istruzioni e informazioni","strand":"mediation","stage_year":4,"priority":"core","prerequisites":["eng.us.mediation.b1-summarise","eng.us.prof.reading-work-b1"],"objectives":["Riferire istruzioni e informazioni essenziali","Semplificare un messaggio per un interlocutore"],"mastery_evidence":["Mantiene i vincoli importanti","Riformula senza alterare il significato"],"difficulty_levers":["mediation_demand","professional_domain"],"cefr_anchor":"B1","progression_stage":"B1_plus"},{"id":"eng.us.prof.integrated-b1plus-target","title":"Competenza integrata B1/B1+ professionale","strand":"integrated_language_use","stage_year":5,"priority":"gateway","prerequisites":["eng.us.prof.interaction-service-b1","eng.us.prof.writing-work-b1","eng.us.prof.mediation-work-b1","eng.us.prof.listening-work-b1"],"objectives":["Integrare ricezione, produzione, interazione e mediazione in compiti professionali","Operare con autonomia sufficiente in scenari prevedibili"],"mastery_evidence":["Completa un compito professionale multi-step","Gestisce chiarimenti e imprevisti semplici"],"difficulty_levers":["transfer_distance","professional_domain"],"cefr_anchor":"B1","progression_stage":"B1_plus"},{"id":"eng.us.prof.b2-extension","title":"Estensione verso B2 in contesti professionali","strand":"integrated_language_use","stage_year":5,"priority":"extension","prerequisites":["eng.us.prof.integrated-b1plus-target","eng.us.integrated.b1plus-independent"],"objectives":["Affrontare input e compiti più complessi per studenti pronti","Estendere autonomia e precisione verso descrittori B2 pertinenti"],"mastery_evidence":["Mostra prestazioni oltre il target B1/B1+ senza dipendere da forte supporto","Trasferisce strategie a contesti meno prevedibili"],"difficulty_levers":["language_demand","support_fading"],"cefr_anchor":"B2","progression_stage":"B2_developing"}]}