{"version":"0.8.0","subject":"mathematics","school_stage":"upper_secondary","curriculum_profile":"it-upper-math-scientifico-v0.8","effective_from_school_year":"2026/27","effective_to_school_year":null,"sequencing_note":"Overlay scientifico/scienze applicate: profondità simbolica, modellizzazione e analisi integrata.","layer":{"kind":"profile","family":"liceo","profile_ids":["it.upper.liceo-scientifico","it.upper.liceo-scientifico-scienze-applicate"]},"nodes":[{"id":"math.us.scientifico.algebra.structures","title":"Strutture algebriche e controllo simbolico avanzato","strand":"algebra","stage_year":2,"priority":"supporting","prerequisites":["math.us.liceo.algebra.parameters","math.us.algebra.factorisation"],"objectives":["Confrontare strategie di trasformazione e fattorizzazione","Gestire espressioni più dense senza perdere condizioni"],"mastery_evidence":["Sceglie trasformazioni efficienti","Mantiene controllo di segni e domini"],"difficulty_levers":["symbolic_density","strategy_selection"]},{"id":"math.us.scientifico.geometry.vectors","title":"Vettori e rappresentazione geometrica","strand":"analytic_geometry","stage_year":3,"priority":"core","prerequisites":["math.us.liceo.geometry.analytic-lines"],"objectives":["Usare vettori per descrivere spostamenti e relazioni geometriche","Collegare componenti, modulo e direzione"],"mastery_evidence":["Passa tra forma geometrica e componenti","Usa vettori in semplici dimostrazioni o problemi"],"difficulty_levers":["representation_demand","reasoning_demand"]},{"id":"math.us.scientifico.functions.transformations","title":"Trasformazioni e composizione di funzioni","strand":"functions","stage_year":3,"priority":"core","prerequisites":["math.us.functions.polynomial-rational"],"objectives":["Studiare composizione e trasformazioni del grafico","Riconoscere simmetrie, traslazioni e scale"],"mastery_evidence":["Prevede l'effetto di una trasformazione","Collega formula e grafico senza campionamento casuale"],"difficulty_levers":["representation_demand","symbolic_density"]},{"id":"math.us.scientifico.probability.random-variables","title":"Variabili aleatorie discrete","strand":"statistics_probability","stage_year":4,"priority":"supporting","prerequisites":["math.us.data.combinatorics-probability"],"objectives":["Descrivere variabili aleatorie discrete e valori attesi nei casi semplici","Collegare distribuzione e fenomeno"],"mastery_evidence":["Costruisce una distribuzione coerente","Interpreta il valore atteso senza confonderlo con esito certo"],"difficulty_levers":["conceptual_novelty","reasoning_demand"]},{"id":"math.us.scientifico.calculus.optimization","title":"Ottimizzazione con derivate","strand":"calculus_derivatives","stage_year":5,"priority":"core","prerequisites":["math.us.liceo.derivatives.study","math.us.practice.model-validation"],"objectives":["Tradurre problemi di massimo/minimo in una funzione","Usare la derivata e controllare il risultato nel contesto"],"mastery_evidence":["Definisce dominio e funzione obiettivo","Interpreta l'estremo in modo contestuale"],"difficulty_levers":["modelling","transfer_distance"]},{"id":"math.us.scientifico.calculus.integrated-analysis","title":"Analisi integrata e problemi di sintesi","strand":"mathematical_practices","stage_year":5,"priority":"extension","prerequisites":["math.us.liceo.integrals.basic","math.us.scientifico.calculus.optimization"],"objectives":["Integrare limiti, derivate, integrali e modellizzazione","Confrontare più strategie in problemi non routinari"],"mastery_evidence":["Costruisce una soluzione coerente e verificabile","Spiega perché la strategia scelta è appropriata"],"difficulty_levers":["reasoning_demand","transfer_distance","strategy_selection"]}]}