{"version":"0.8.0","subject":"english","school_stage":"upper_secondary","curriculum_profile":"it-upper-english-liceo-b2-v0.8","effective_from_school_year":"2026/27","effective_to_school_year":null,"sequencing_note":"Overlay liceale verso B2: autonomia ricettiva, argomentazione, produzione, interazione e mediazione.","layer":{"kind":"family_core","family":"liceo","profile_ids":[]},"nodes":[{"id":"eng.us.liceo.reading.b2-complex-argument","title":"Reading B2: argomentazione complessa e posizione dell'autore","strand":"reading","stage_year":3,"priority":"gateway","prerequisites":["eng.us.reading.b1plus-viewpoints"],"objectives":["Comprendere testi con argomentazione sostenuta e lessico meno frequente","Individuare posizione, concessioni e implicazioni"],"mastery_evidence":["Ricostruisce struttura e punto di vista","Distingue evidenza, esempio e valutazione"],"difficulty_levers":["language_demand","reasoning_demand"],"cefr_anchor":"B2","progression_stage":"B2_developing"},{"id":"eng.us.liceo.listening.b2-extended","title":"Listening B2: interventi estesi e relazioni implicite","strand":"listening","stage_year":3,"priority":"core","prerequisites":["eng.us.listening.b1plus-attitude"],"objectives":["Seguire discorsi più lunghi e relativamente complessi","Cogliere relazioni tra idee anche non sempre segnalate esplicitamente"],"mastery_evidence":["Mantiene la linea argomentativa","Coglie atteggiamento e inferenze plausibili"],"difficulty_levers":["discourse_span","language_demand"],"cefr_anchor":"B2","progression_stage":"B2_developing"},{"id":"eng.us.liceo.grammar.b2-control","title":"Controllo grammaticale B2 in produzione estesa","strand":"grammar","stage_year":3,"priority":"core","prerequisites":["eng.us.grammar.complex-sentences-b1plus"],"objectives":["Aumentare varietà sintattica e controllo dei tempi","Usare passivo, modali e subordinazione per scopi discorsivi"],"mastery_evidence":["La forma sostiene il significato senza errori sistematici","Usa strutture complesse senza perdere chiarezza"],"difficulty_levers":["precision_demand","language_demand"],"cefr_anchor":"B2","progression_stage":"B2_developing"},{"id":"eng.us.liceo.writing.b2-argument","title":"Writing B2: saggio breve e argomentazione","strand":"writing","stage_year":4,"priority":"gateway","prerequisites":["eng.us.liceo.reading.b2-complex-argument","eng.us.writing.b1plus-revision"],"objectives":["Sviluppare un'argomentazione con vantaggi/svantaggi o tesi motivata","Integrare esempi e controargomentazioni"],"mastery_evidence":["Organizza una posizione sostenuta e bilanciata","Registro e coesione sono adeguati allo scopo"],"difficulty_levers":["discourse_span","reasoning_demand"],"cefr_anchor":"B2","progression_stage":"B2_developing"},{"id":"eng.us.liceo.interaction.b2-discussion","title":"Interazione B2: discussione e negoziazione di significato","strand":"spoken_interaction","stage_year":4,"priority":"core","prerequisites":["eng.us.liceo.grammar.b2-control","eng.us.interaction.b1plus-problem-solving"],"objectives":["Partecipare attivamente a discussioni su temi astratti accessibili","Chiarire, qualificare e difendere un punto di vista"],"mastery_evidence":["Risponde alle argomentazioni altrui","Usa strategie di chiarimento e concessione"],"difficulty_levers":["productive_freedom","reasoning_demand"],"cefr_anchor":"B2","progression_stage":"B2_developing"},{"id":"eng.us.liceo.production.b2-presentation","title":"Produzione orale B2: esposizione e argomentazione","strand":"spoken_production","stage_year":4,"priority":"core","prerequisites":["eng.us.production.b1plus-presentation","eng.us.liceo.writing.b2-argument"],"objectives":["Sviluppare una presentazione chiara e dettagliata","Sostenere un punto con esempi e rispondere a domande"],"mastery_evidence":["Organizzazione e sviluppo sono coerenti","Adatta spiegazione alle domande ricevute"],"difficulty_levers":["discourse_span","productive_freedom"],"cefr_anchor":"B2","progression_stage":"B2_developing"},{"id":"eng.us.liceo.mediation.b2-synthesis","title":"Mediazione B2: sintetizzare più fonti","strand":"mediation","stage_year":4,"priority":"core","prerequisites":["eng.us.mediation.b1plus-data","eng.us.liceo.reading.b2-complex-argument"],"objectives":["Integrare punti principali da più fonti","Riformulare informazioni complesse per un destinatario"],"mastery_evidence":["Non giustappone copie delle fonti","Segnala accordi, differenze e priorità"],"difficulty_levers":["mediation_demand","information_load"],"cefr_anchor":"B2","progression_stage":"B2_developing"},{"id":"eng.us.liceo.reading.b2-independent","title":"Reading B2 autonomo e selettivo","strand":"reading","stage_year":5,"priority":"gateway","prerequisites":["eng.us.liceo.reading.b2-complex-argument","eng.us.strategy.autonomous-reference"],"objectives":["Leggere in modo ampiamente autonomo adattando strategia e velocità","Gestire testi lunghi e lessico meno frequente con consultazione selettiva"],"mastery_evidence":["Individua rapidamente informazioni e argomentazioni","Usa fonti di riferimento senza spezzare la comprensione"],"difficulty_levers":["support_fading","information_load"],"cefr_anchor":"B2","progression_stage":"B2_target"},{"id":"eng.us.liceo.listening.b2-independent","title":"Listening B2 autonomo","strand":"listening","stage_year":5,"priority":"gateway","prerequisites":["eng.us.liceo.listening.b2-extended","eng.us.listening.b1plus-authentic-speed"],"objectives":["Comprendere idee principali e dettagli rilevanti in audio B2","Seguire discorsi con maggiore densità e variazione"],"mastery_evidence":["Coglie struttura e atteggiamento","Recupera dettagli senza affidarsi a parole isolate"],"difficulty_levers":["language_demand","support_fading"],"cefr_anchor":"B2","progression_stage":"B2_target"},{"id":"eng.us.liceo.integrated.b2-target","title":"Competenza integrata B2","strand":"integrated_language_use","stage_year":5,"priority":"gateway","prerequisites":["eng.us.liceo.reading.b2-independent","eng.us.liceo.listening.b2-independent","eng.us.liceo.writing.b2-argument","eng.us.liceo.interaction.b2-discussion"],"objectives":["Completare compiti integrati B2 in ambito personale, educativo e culturale","Mantenere autonomia, coerenza e adattamento al destinatario"],"mastery_evidence":["Integra le quattro modalità comunicative con supporto limitato","Mantiene qualità sufficiente anche in transfer"],"difficulty_levers":["transfer_distance","productive_freedom"],"cefr_anchor":"B2","progression_stage":"B2_target"},{"id":"eng.us.liceo.intercultural.b2-analysis","title":"Analisi culturale e interculturale B2","strand":"intercultural","stage_year":5,"priority":"supporting","prerequisites":["eng.us.liceo.integrated.b2-target","eng.us.intercultural.b1plus-perspectives"],"objectives":["Analizzare prodotti e prospettive culturali con linguaggio argomentativo","Mettere in relazione contesti senza generalizzazioni rigide"],"mastery_evidence":["Sostiene confronti con evidenze","Usa linguaggio sfumato e contestualizzato"],"difficulty_levers":["reasoning_demand","language_demand"],"cefr_anchor":"B2","progression_stage":"B2_target"}]}