{"version":"0.8.0","subject":"english","school_stage":"upper_secondary","curriculum_profile":"it-upper-english-tecnico-b2-v0.8","effective_from_school_year":"2026/27","effective_to_school_year":null,"sequencing_note":"Overlay tecnico verso B2 con integrazione di lingua generale e linguaggi settoriali.","layer":{"kind":"family_core","family":"tecnico","profile_ids":[]},"nodes":[{"id":"eng.us.tecnico.vocabulary-technical-b1plus","title":"Lessico tecnico-professionale B1+","strand":"professional_language","stage_year":3,"priority":"core","prerequisites":["eng.us.vocabulary.education-work-b1plus"],"objectives":["Comprendere e usare lessico settoriale ad alta frequenza","Spiegare termini tecnici con parole più semplici"],"mastery_evidence":["Usa collocazioni settoriali plausibili","Parafrasa senza traduzione parola per parola"],"difficulty_levers":["language_demand","transfer_distance"],"cefr_anchor":"B1","progression_stage":"B1_plus"},{"id":"eng.us.tecnico.reading-docs-b1plus","title":"Reading tecnico: istruzioni, specifiche e documentazione","strand":"reading","stage_year":3,"priority":"core","prerequisites":["eng.us.reading.b1plus-viewpoints","eng.us.tecnico.vocabulary-technical-b1plus"],"objectives":["Leggere istruzioni, schede e documentazione accessibile","Individuare vincoli, sequenze e dati operativi"],"mastery_evidence":["Distingue requisiti e raccomandazioni","Trova dati specifici senza leggere tutto linearmente"],"difficulty_levers":["information_load","strategy_selection"],"cefr_anchor":"B1","progression_stage":"B1_plus"},{"id":"eng.us.tecnico.interaction-work-b1plus","title":"Interazione in contesti di progetto e lavoro","strand":"spoken_interaction","stage_year":3,"priority":"core","prerequisites":["eng.us.interaction.b1plus-problem-solving","eng.us.tecnico.vocabulary-technical-b1plus"],"objectives":["Coordinare compiti, segnalare problemi e proporre soluzioni","Chiedere chiarimenti su requisiti e tempi"],"mastery_evidence":["Usa linguaggio funzionale al compito","Conferma comprensione e accordi"],"difficulty_levers":["productive_freedom","professional_domain"],"cefr_anchor":"B1","progression_stage":"B1_plus"},{"id":"eng.us.tecnico.reading-b2-technical","title":"Reading B2 tecnico e informativo","strand":"reading","stage_year":4,"priority":"gateway","prerequisites":["eng.us.tecnico.reading-docs-b1plus","eng.us.reading.b1plus-longer-texts"],"objectives":["Comprendere documentazione e articoli informativi più densi","Integrare testo, tabelle e diagrammi"],"mastery_evidence":["Seleziona informazioni rilevanti da più rappresentazioni","Interpreta relazioni e condizioni"],"difficulty_levers":["language_demand","representation_demand"],"cefr_anchor":"B2","progression_stage":"B2_developing"},{"id":"eng.us.tecnico.listening-b2-work","title":"Listening B2 in contesti tecnici/professionali","strand":"listening","stage_year":4,"priority":"core","prerequisites":["eng.us.listening.b1plus-authentic-speed","eng.us.tecnico.vocabulary-technical-b1plus"],"objectives":["Seguire briefing, spiegazioni e presentazioni tecniche accessibili","Cogliere problemi, decisioni e azioni richieste"],"mastery_evidence":["Distingue informazioni operative da dettagli secondari","Ricostruisce sequenze e responsabilità"],"difficulty_levers":["language_demand","information_load"],"cefr_anchor":"B2","progression_stage":"B2_developing"},{"id":"eng.us.tecnico.writing-b2-report","title":"Writing B2: report e comunicazione professionale","strand":"writing","stage_year":4,"priority":"gateway","prerequisites":["eng.us.writing.b1plus-revision","eng.us.tecnico.reading-b2-technical"],"objectives":["Scrivere report brevi, email formali e sintesi tecniche","Organizzare informazioni per lettori diversi"],"mastery_evidence":["Struttura e registro sono funzionali allo scopo","Dati e raccomandazioni sono distinguibili"],"difficulty_levers":["discourse_span","professional_domain"],"cefr_anchor":"B2","progression_stage":"B2_developing"},{"id":"eng.us.tecnico.mediation-b2-data","title":"Mediazione B2 di dati e procedure","strand":"mediation","stage_year":4,"priority":"core","prerequisites":["eng.us.mediation.b1plus-data","eng.us.tecnico.reading-b2-technical"],"objectives":["Spiegare grafici, procedure e requisiti a interlocutori diversi","Riformulare tecnicismi quando necessario"],"mastery_evidence":["Seleziona tendenze e vincoli rilevanti","Adatta precisione e terminologia al destinatario"],"difficulty_levers":["mediation_demand","representation_demand"],"cefr_anchor":"B2","progression_stage":"B2_developing"},{"id":"eng.us.tecnico.reading-b2-independent","title":"Reading B2 autonomo tecnico-generale","strand":"reading","stage_year":5,"priority":"gateway","prerequisites":["eng.us.tecnico.reading-b2-technical","eng.us.strategy.autonomous-reference"],"objectives":["Leggere autonomamente testi generali e settoriali B2","Usare consultazione selettiva per termini specialistici"],"mastery_evidence":["Mantiene comprensione globale senza traduzione continua","Trova evidenze e requisiti con rapidità"],"difficulty_levers":["support_fading","language_demand"],"cefr_anchor":"B2","progression_stage":"B2_target"},{"id":"eng.us.tecnico.listening-b2-independent","title":"Listening B2 autonomo tecnico-generale","strand":"listening","stage_year":5,"priority":"gateway","prerequisites":["eng.us.tecnico.listening-b2-work"],"objectives":["Seguire spiegazioni, interviste e briefing B2","Adattare strategia a scopo e densità dell'audio"],"mastery_evidence":["Coglie gist, dettagli e atteggiamento rilevanti","Tollera passaggi non compresi senza perdere il compito"],"difficulty_levers":["support_fading","information_load"],"cefr_anchor":"B2","progression_stage":"B2_target"},{"id":"eng.us.tecnico.integrated-b2-target","title":"Competenza integrata B2 tecnico-professionale","strand":"integrated_language_use","stage_year":5,"priority":"gateway","prerequisites":["eng.us.tecnico.reading-b2-independent","eng.us.tecnico.listening-b2-independent","eng.us.tecnico.writing-b2-report","eng.us.tecnico.mediation-b2-data"],"objectives":["Integrare lingua generale e settoriale in compiti B2","Gestire documentazione, comunicazione e problem solving con autonomia"],"mastery_evidence":["Completa un compito multi-fonte e multi-modalità","Mantiene registro, precisione e comprensibilità"],"difficulty_levers":["transfer_distance","professional_domain"],"cefr_anchor":"B2","progression_stage":"B2_target"}]}