{
  "version": "0.1.0",
  "subject": "mathematics",
  "school_stage": "upper_secondary",
  "curriculum_profile": "it-upper-math-gateway-2026",
  "effective_from_school_year": "2026/27",
  "effective_to_school_year": null,
  "sequencing_note": "Gateway architetturali tra terza media e primo biennio. Non costituiscono ancora il curriculum completo v0.8.",
  "layer": {
    "kind": "common_core",
    "family": null,
    "profile_ids": [],
    "notes": "Layer comune usato per verificare prerequisiti verticali e composizione tra profili."
  },
  "nodes": [
    {
      "id": "math.us.gateway.algebra-control",
      "title": "Controllo algebrico d'ingresso al biennio",
      "strand": "algebra_foundations",
      "stage_year": 1,
      "priority": "gateway",
      "prerequisites": [
        "math.numbers.signed-operations",
        "math.relations.algebraic-expressions",
        "math.relations.first-degree-equations"
      ],
      "objectives": [
        "Verificare che segni, equivalenze e trasformazioni algebriche siano abbastanza stabili per affrontare il biennio",
        "Distinguere un errore di manipolazione simbolica da una lacuna concettuale precedente"
      ],
      "mastery_evidence": [
        "Trasforma semplici espressioni ed equazioni mantenendo equivalenza e controllo dei segni",
        "Sa motivare almeno un passaggio invece di applicare soltanto una procedura memorizzata"
      ],
      "diagnostic_signals": [
        "Errori sistematici con numeri relativi",
        "Trasporto di termini senza conservare l'equivalenza",
        "Procedura corretta solo su forme identiche agli esempi"
      ],
      "difficulty_levers": ["symbolic_density", "process_depth", "reasoning_demand"],
      "applies_to_profile_ids": [],
      "excludes_profile_ids": [],
      "notes": "Nodo gateway, non dichiarazione esaustiva del programma di prima superiore."
    },
    {
      "id": "math.us.gateway.representations-modelling",
      "title": "Rappresentazioni e modellizzazione d'ingresso al biennio",
      "strand": "relations_functions",
      "stage_year": 1,
      "priority": "gateway",
      "prerequisites": [
        "math.relations.multiple-representations",
        "math.practice.modelling",
        "math.practice.integrated-problem-solving"
      ],
      "objectives": [
        "Passare tra linguaggio naturale, tabella, formula e rappresentazione cartesiana in situazioni accessibili",
        "Scegliere una rappresentazione utile invece di trattarle come esercizi separati"
      ],
      "mastery_evidence": [
        "Mantiene lo stesso significato passando tra almeno tre rappresentazioni",
        "Giustifica quale rappresentazione rende più semplice rispondere alla domanda"
      ],
      "diagnostic_signals": [
        "Conosce le rappresentazioni isolate ma non le collega",
        "Formula priva di interpretazione nel contesto",
        "Scelta strategica assente"
      ],
      "difficulty_levers": ["representation_demand", "strategy_selection", "transfer_distance"],
      "applies_to_profile_ids": [],
      "excludes_profile_ids": []
    }
  ]
}
