{"version":"0.8.0","subject":"mathematics","school_stage":"upper_secondary","curriculum_profile":"it-upper-math-tecnico-v0.8","effective_from_school_year":"2026/27","effective_to_school_year":null,"sequencing_note":"Overlay tecnico in transizione 2026/27: matematica applicata, dati, strumenti e modellizzazione.","layer":{"kind":"family_core","family":"tecnico","profile_ids":[]},"nodes":[{"id":"math.us.tecnico.formulas-units","title":"Formule, grandezze e controllo delle unità","strand":"applied_measurement","stage_year":1,"priority":"core","prerequisites":["math.us.gateway.technical-modelling"],"objectives":["Ricavare una grandezza da formule semplici","Controllare coerenza dimensionale e ordine di grandezza"],"mastery_evidence":["Isola correttamente l'incognita","Rifiuta risultati con unità incoerenti"],"difficulty_levers":["precision_demand","modelling"]},{"id":"math.us.tecnico.spreadsheets-models","title":"Tabelle, fogli di calcolo e modelli","strand":"modelling","stage_year":1,"priority":"supporting","prerequisites":["math.us.functions.linear-functions","math.us.tecnico.formulas-units"],"objectives":["Costruire tabelle e formule ripetibili per modelli semplici","Controllare input, output e errori di riferimento"],"mastery_evidence":["Formula correttamente una dipendenza","Verifica output anomali"],"difficulty_levers":["tool_use","representation_demand"]},{"id":"math.us.tecnico.financial-percentages","title":"Percentuali composte e variazioni","strand":"financial_math","stage_year":2,"priority":"core","prerequisites":["math.us.algebra.linear-equations","math.numbers.percentages"],"objectives":["Gestire aumenti, sconti e variazioni successive","Distinguere punti percentuali e variazioni percentuali"],"mastery_evidence":["Usa fattori moltiplicativi coerenti","Interpreta correttamente il risultato"],"difficulty_levers":["precision_demand","transfer_distance"]},{"id":"math.us.tecnico.systems-applications","title":"Sistemi lineari in contesti tecnici/economici","strand":"equations_inequalities","stage_year":2,"priority":"core","prerequisites":["math.us.algebra.systems-linear","math.us.gateway.technical-modelling"],"objectives":["Modellizzare problemi con sistemi lineari","Interpretare la soluzione e i vincoli"],"mastery_evidence":["Costruisce equazioni coerenti con le grandezze","Controlla fattibilità e unità"],"difficulty_levers":["modelling","strategy_selection"]},{"id":"math.us.tecnico.data-regression-intro","title":"Relazioni tra dati e regressione intuitiva","strand":"statistics_probability","stage_year":3,"priority":"core","prerequisites":["math.us.data.descriptive-statistics","math.us.functions.linear-functions"],"objectives":["Interpretare scatterplot e tendenza","Usare un modello lineare semplice senza confondere correlazione e causalità"],"mastery_evidence":["Descrive direzione e forza qualitativa","Esplicita limiti della previsione"],"difficulty_levers":["representation_demand","reasoning_demand"]},{"id":"math.us.tecnico.exp-growth-applications","title":"Crescita esponenziale in contesti applicati","strand":"exponential_log","stage_year":3,"priority":"core","prerequisites":["math.us.explog.exponential-concept","math.us.tecnico.financial-percentages"],"objectives":["Modellizzare crescita/decadimento e interesse composto","Interpretare parametri e tempi caratteristici"],"mastery_evidence":["Distingue modello lineare ed esponenziale","Controlla plausibilità dei parametri"],"difficulty_levers":["modelling","representation_demand"]},{"id":"math.us.tecnico.trig-measurement","title":"Trigonometria per misure indirette","strand":"trigonometry","stage_year":3,"priority":"core","prerequisites":["math.us.trigonometry.triangle-solving","math.us.tecnico.formulas-units"],"objectives":["Usare trigonometria in misure indirette","Stimare errore e precisione in casi accessibili"],"mastery_evidence":["Costruisce un diagramma coerente","Mantiene unità e arrotondamenti appropriati"],"difficulty_levers":["modelling","precision_demand"]},{"id":"math.us.tecnico.probability-risk","title":"Probabilità, rischio e decisione","strand":"statistics_probability","stage_year":4,"priority":"core","prerequisites":["math.us.data.conditional-probability-intro","math.us.data.combinatorics-probability"],"objectives":["Interpretare rischio e probabilità condizionata in contesti applicati","Confrontare opzioni usando dati e probabilità"],"mastery_evidence":["Distingue probabilità assolute e condizionate","Motiva una decisione con criteri espliciti"],"difficulty_levers":["reasoning_demand","transfer_distance"]},{"id":"math.us.tecnico.functions-optimization","title":"Funzioni e ottimizzazione applicata","strand":"functions","stage_year":4,"priority":"core","prerequisites":["math.us.functions.precalculus-analysis","math.us.gateway.technical-modelling"],"objectives":["Confrontare modelli e individuare valori ottimali","Usare grafici, tabelle o strumenti per supportare decisioni"],"mastery_evidence":["Definisce obiettivo e vincoli","Verifica la soluzione nel contesto"],"difficulty_levers":["modelling","strategy_selection"]},{"id":"math.us.tecnico.change-rate","title":"Tasso di variazione e derivata applicata","strand":"calculus_derivatives","stage_year":5,"priority":"supporting","prerequisites":["math.us.functions.precalculus-analysis","math.us.tecnico.functions-optimization"],"objectives":["Interpretare il tasso di variazione istantaneo in casi applicati","Usare derivate elementari dove pertinenti al percorso"],"mastery_evidence":["Collega segno della derivata e andamento","Interpreta unità e significato del tasso"],"difficulty_levers":["conceptual_novelty","transfer_distance"]},{"id":"math.us.tecnico.data-decision","title":"Dati, indicatori e decisioni quantitative","strand":"statistics_probability","stage_year":5,"priority":"gateway","prerequisites":["math.us.tecnico.data-regression-intro","math.us.data.statistical-reasoning"],"objectives":["Valutare indicatori e confronti quantitativi","Comunicare una conclusione con limiti e incertezza"],"mastery_evidence":["Sceglie indicatori coerenti","Evita conclusioni causali non giustificate"],"difficulty_levers":["reasoning_demand","information_load"]},{"id":"math.us.tecnico.integrated-project","title":"Progetto quantitativo integrato","strand":"modelling","stage_year":5,"priority":"core","prerequisites":["math.us.tecnico.data-decision","math.us.practice.model-validation"],"objectives":["Costruire un modello quantitativo per un problema del percorso","Documentare dati, formule, strumenti, verifiche e limiti"],"mastery_evidence":["Il modello è riproducibile e interpretabile","Le conclusioni sono coerenti con ipotesi e dati"],"difficulty_levers":["transfer_distance","tool_use","reasoning_demand"]}]}