{"version":"0.8.0","subject":"mathematics","school_stage":"upper_secondary","curriculum_profile":"it-upper-math-liceo-v0.8","effective_from_school_year":"2026/27","effective_to_school_year":null,"sequencing_note":"Overlay liceale: maggiore formalizzazione, geometria analitica e avvio all'analisi.","layer":{"kind":"family_core","family":"liceo","profile_ids":[]},"nodes":[{"id":"math.us.liceo.geometry.proof","title":"Dimostrazione e struttura della geometria","strand":"geometry","stage_year":1,"priority":"core","prerequisites":["math.us.gateway.scientific-reasoning"],"objectives":["Usare definizioni, ipotesi e tesi in semplici dimostrazioni","Distinguere verifica empirica e argomento deduttivo"],"mastery_evidence":["Costruisce una catena logica leggibile","Indica il ruolo delle ipotesi"],"difficulty_levers":["reasoning_demand","precision_demand"]},{"id":"math.us.liceo.algebra.parameters","title":"Equazioni e problemi con parametri semplici","strand":"equations_inequalities","stage_year":2,"priority":"supporting","prerequisites":["math.us.algebra.quadratic-equations"],"objectives":["Analizzare come cambia la soluzione al variare di un parametro","Classificare casi senza calcolare alla cieca"],"mastery_evidence":["Distingue casi significativi","Collega parametro e numero/natura delle soluzioni"],"difficulty_levers":["reasoning_demand","symbolic_density"]},{"id":"math.us.liceo.geometry.analytic-lines","title":"Geometria analitica della retta","strand":"analytic_geometry","stage_year":2,"priority":"gateway","prerequisites":["math.us.functions.linear-functions","math.geometry.cartesian-plane"],"objectives":["Descrivere rette con equazioni e parametri","Studiare parallelismo, perpendicolarità e intersezioni"],"mastery_evidence":["Passa tra dati geometrici ed equazione","Interpreta coefficiente angolare e distanza in modo coerente"],"difficulty_levers":["representation_demand","precision_demand"]},{"id":"math.us.liceo.geometry.conics","title":"Coniche nel piano cartesiano","strand":"analytic_geometry","stage_year":3,"priority":"core","prerequisites":["math.us.liceo.geometry.analytic-lines","math.us.functions.quadratic-functions"],"objectives":["Studiare parabola e circonferenza, introducendo altre coniche dove previsto","Collegare equazione, elementi geometrici e grafico"],"mastery_evidence":["Ricava proprietà geometriche dall'equazione","Imposta problemi di luogo geometrico semplici"],"difficulty_levers":["representation_demand","symbolic_density"]},{"id":"math.us.liceo.trigonometry.identities","title":"Identità e relazioni goniometriche","strand":"trigonometry","stage_year":4,"priority":"core","prerequisites":["math.us.trigonometry.functions"],"objectives":["Usare relazioni fondamentali per trasformare espressioni","Risolvere problemi trigonometrici con scelta strategica"],"mastery_evidence":["Trasforma mantenendo equivalenza","Controlla dominio e periodicità"],"difficulty_levers":["symbolic_density","strategy_selection"]},{"id":"math.us.liceo.trigonometry.equations","title":"Equazioni goniometriche","strand":"trigonometry","stage_year":4,"priority":"core","prerequisites":["math.us.liceo.trigonometry.identities"],"objectives":["Risolvere equazioni goniometriche standard","Rappresentare famiglie infinite di soluzioni"],"mastery_evidence":["Gestisce periodicità e intervalli","Controlla le soluzioni nel problema"],"difficulty_levers":["process_depth","precision_demand"]},{"id":"math.us.liceo.limits.intuition","title":"Limite come comportamento locale e globale","strand":"calculus_limits","stage_year":4,"priority":"gateway","prerequisites":["math.us.functions.precalculus-analysis"],"objectives":["Interpretare intuitivamente limiti finiti e infiniti","Leggere il comportamento da grafico e formula"],"mastery_evidence":["Distingue valore della funzione e limite","Collega limite ad asintoti e continuità"],"difficulty_levers":["conceptual_novelty","representation_demand"]},{"id":"math.us.liceo.limits.calculation","title":"Calcolo di limiti","strand":"calculus_limits","stage_year":5,"priority":"gateway","prerequisites":["math.us.liceo.limits.intuition","math.us.algebra.rational-expressions"],"objectives":["Calcolare limiti con tecniche adeguate","Riconoscere forme indeterminate nei casi previsti"],"mastery_evidence":["Sceglie trasformazioni motivate","Controlla il risultato sul comportamento della funzione"],"difficulty_levers":["strategy_selection","process_depth"]},{"id":"math.us.liceo.derivatives.concept","title":"Derivata come tasso di variazione e tangente","strand":"calculus_derivatives","stage_year":5,"priority":"gateway","prerequisites":["math.us.liceo.limits.calculation"],"objectives":["Interpretare derivata geometricamente e come variazione","Collegare derivabilità e comportamento locale"],"mastery_evidence":["Spiega il significato della derivata in più rappresentazioni","Distingue pendenza media e istantanea"],"difficulty_levers":["conceptual_novelty","representation_demand"]},{"id":"math.us.liceo.derivatives.rules","title":"Regole di derivazione","strand":"calculus_derivatives","stage_year":5,"priority":"core","prerequisites":["math.us.liceo.derivatives.concept"],"objectives":["Derivare funzioni elementari e composizioni previste","Usare la derivata per analisi e verifica"],"mastery_evidence":["Applica regole senza perdere struttura","Controlla risultati con casi semplici"],"difficulty_levers":["process_depth","precision_demand"]},{"id":"math.us.liceo.derivatives.study","title":"Studio di funzione con derivate","strand":"calculus_derivatives","stage_year":5,"priority":"gateway","prerequisites":["math.us.liceo.derivatives.rules","math.us.functions.precalculus-analysis"],"objectives":["Usare derivate per monotonia, estremi e concavità dove prevista","Integrare dominio, limiti e derivate in uno studio coerente"],"mastery_evidence":["Produce un grafico qualitativo coerente","Motiva intervalli ed estremi"],"difficulty_levers":["reasoning_demand","representation_demand"]},{"id":"math.us.liceo.integrals.concept","title":"Integrale e accumulazione","strand":"calculus_integrals","stage_year":5,"priority":"core","prerequisites":["math.us.liceo.derivatives.concept"],"objectives":["Interpretare integrale come accumulazione/area orientata","Collegare primitive e derivazione nei casi base"],"mastery_evidence":["Passa tra interpretazione geometrica e simbolica","Distingue integrale definito e primitiva"],"difficulty_levers":["conceptual_novelty","representation_demand"]},{"id":"math.us.liceo.integrals.basic","title":"Integrali elementari e applicazioni","strand":"calculus_integrals","stage_year":5,"priority":"core","prerequisites":["math.us.liceo.integrals.concept","math.us.liceo.derivatives.rules"],"objectives":["Calcolare integrali elementari previsti","Usare integrali in semplici problemi di area/accumulazione"],"mastery_evidence":["Sceglie una primitiva corretta","Interpreta il segno e le unità del risultato"],"difficulty_levers":["process_depth","transfer_distance"]}]}