{"version":"0.8.0","subject":"mathematics","school_stage":"upper_secondary","curriculum_profile":"it-upper-math-professionale-v0.8","effective_from_school_year":"2026/27","effective_to_school_year":null,"sequencing_note":"Overlay professionale: matematica funzionale, misure, dati e decisioni quantitative legate ai contesti operativi.","layer":{"kind":"family_core","family":"professionale","profile_ids":[]},"nodes":[{"id":"math.us.prof.measurement-workplace","title":"Misure, scale e conversioni in contesti professionali","strand":"applied_measurement","stage_year":1,"priority":"gateway","prerequisites":["math.practice.measurement-units","math.us.gateway.representations-modelling"],"objectives":["Usare unità, scale e conversioni in compiti pratici","Controllare tolleranze e ordine di grandezza"],"mastery_evidence":["Sceglie unità adeguate","Individua conversioni implausibili"],"difficulty_levers":["precision_demand","transfer_distance"]},{"id":"math.us.prof.formulas-practical","title":"Formule e proporzioni applicate","strand":"modelling","stage_year":1,"priority":"core","prerequisites":["math.numbers.proportions","math.us.prof.measurement-workplace"],"objectives":["Usare e trasformare formule semplici","Applicare proporzioni quando il modello è realmente proporzionale"],"mastery_evidence":["Isola l'incognita e interpreta le grandezze","Non usa la proporzione fuori contesto"],"difficulty_levers":["modelling","strategy_selection"]},{"id":"math.us.prof.percent-finance","title":"Percentuali, costi e calcoli finanziari di base","strand":"financial_math","stage_year":2,"priority":"gateway","prerequisites":["math.numbers.percentages","math.us.prof.formulas-practical"],"objectives":["Calcolare sconti, maggiorazioni, IVA e variazioni","Confrontare costi e offerte"],"mastery_evidence":["Usa basi percentuali corrette","Spiega quale opzione è conveniente e perché"],"difficulty_levers":["transfer_distance","precision_demand"]},{"id":"math.us.prof.data-tables","title":"Tabelle, grafici e indicatori operativi","strand":"statistics_probability","stage_year":2,"priority":"core","prerequisites":["math.data.tables-charts","math.us.data.descriptive-statistics"],"objectives":["Leggere e costruire tabelle/grafici di dati pratici","Usare media, mediana e percentuali per descrivere un fenomeno"],"mastery_evidence":["Estrae dati corretti e confronta serie","Sceglie un indicatore sensato"],"difficulty_levers":["information_load","representation_demand"]},{"id":"math.us.prof.linear-models","title":"Modelli lineari pratici","strand":"functions","stage_year":3,"priority":"core","prerequisites":["math.us.functions.linear-functions","math.us.prof.formulas-practical"],"objectives":["Usare relazioni lineari in costi, consumi e produttività","Interpretare pendenza e valore iniziale"],"mastery_evidence":["Costruisce una formula da dati semplici","Interpreta i parametri nel contesto"],"difficulty_levers":["modelling","representation_demand"]},{"id":"math.us.prof.probability-risk","title":"Probabilità e rischio in situazioni operative","strand":"statistics_probability","stage_year":3,"priority":"core","prerequisites":["math.us.data.probability-foundations"],"objectives":["Interpretare frequenze e probabilità di eventi","Confrontare rischi relativi a semplici scenari"],"mastery_evidence":["Distingue frequenza osservata e probabilità","Comunica il rischio senza falsa precisione"],"difficulty_levers":["reasoning_demand","transfer_distance"]},{"id":"math.us.prof.growth-decay","title":"Crescita, decadimento e variazioni successive","strand":"exponential_log","stage_year":4,"priority":"supporting","prerequisites":["math.us.prof.percent-finance","math.us.explog.exponential-concept"],"objectives":["Riconoscere processi moltiplicativi ricorrenti","Usare modelli esponenziali semplici dove pertinenti"],"mastery_evidence":["Distingue incremento fisso da percentuale ricorrente","Controlla risultati con stime"],"difficulty_levers":["conceptual_novelty","transfer_distance"]},{"id":"math.us.prof.optimization-practical","title":"Scelte ottimali con vincoli pratici","strand":"modelling","stage_year":4,"priority":"core","prerequisites":["math.us.prof.linear-models","math.us.data.statistical-reasoning"],"objectives":["Confrontare alternative quantitative con vincoli","Formalizzare un criterio di convenienza o efficienza"],"mastery_evidence":["Esplicita obiettivo e vincoli","Motiva la scelta con calcoli verificabili"],"difficulty_levers":["strategy_selection","reasoning_demand"]},{"id":"math.us.prof.data-quality","title":"Qualità dei dati e decisioni","strand":"statistics_probability","stage_year":5,"priority":"gateway","prerequisites":["math.us.prof.data-tables","math.us.prof.probability-risk"],"objectives":["Valutare completezza, variabilità e affidabilità di dati operativi","Riconoscere conclusioni non supportate"],"mastery_evidence":["Identifica limiti del campione/dato","Separa osservazione da interpretazione"],"difficulty_levers":["reasoning_demand","information_load"]},{"id":"math.us.prof.integrated-quantitative-task","title":"Compito quantitativo professionale integrato","strand":"modelling","stage_year":5,"priority":"core","prerequisites":["math.us.prof.optimization-practical","math.us.prof.data-quality"],"objectives":["Integrare misure, percentuali, formule e dati in un problema autentico","Documentare passaggi, controlli e conclusioni"],"mastery_evidence":["La soluzione è ripercorribile","Il risultato è interpretato con unità e limiti"],"difficulty_levers":["transfer_distance","process_depth"]}]}