{
  "version": "0.1.0",
  "subject": "mathematics",
  "school_stage": "upper_secondary",
  "curriculum_profile": "it-upper-math-liceo-scientifico-seed-2026",
  "effective_from_school_year": "2026/27",
  "effective_to_school_year": null,
  "sequencing_note": "Overlay architetturale per verificare la selezione di profili liceali specifici. Non è il curriculum completo v0.8.",
  "layer": {
    "kind": "profile",
    "family": "liceo",
    "profile_ids": [
      "it.upper.liceo-scientifico",
      "it.upper.liceo-scientifico-scienze-applicate"
    ],
    "notes": "Seed condiviso tra scientifico tradizionale e scienze applicate."
  },
  "nodes": [
    {
      "id": "math.us.gateway.scientific-reasoning",
      "title": "Ragionamento simbolico e argomentativo d'ingresso allo scientifico",
      "strand": "mathematical_practices",
      "stage_year": 1,
      "priority": "supporting",
      "prerequisites": ["math.us.gateway.algebra-control"],
      "objectives": ["Collegare trasformazione simbolica e giustificazione", "Riconoscere quando un esempio non basta a dimostrare una proprietà generale"],
      "mastery_evidence": ["Motiva passaggi simbolici essenziali", "Distingue verifica di un caso e argomentazione generale"],
      "diagnostic_signals": ["Risultato corretto senza controllo logico", "Generalizzazione da un solo esempio"],
      "difficulty_levers": ["reasoning_demand", "precision_demand", "transfer_distance"],
      "applies_to_profile_ids": [],
      "excludes_profile_ids": []
    }
  ]
}
